<?xml version="1.0"?>
<!DOCTYPE Report
[
<!ELEMENT Report (General ,(Doc|BPT)) >
<!ATTLIST Report ver CDATA #REQUIRED tmZone CDATA #REQUIRED>

<!ELEMENT General ( DocLocation ) >
<!ATTLIST General productName CDATA #REQUIRED productVer CDATA #REQUIRED os CDATA #REQUIRED host CDATA #REQUIRED qcserver CDATA #IMPLIED qcproject CDATA #IMPLIED SolManSolutionId CDATA #IMPLIED SolManProjectId CDATA #IMPLIED SolManTestPlanId CDATA #IMPLIED SolManTestPackageId CDATA #IMPLIED SolManUserInfoData CDATA #IMPLIED  >

<!ELEMENT BPT (DName,Res,DVer?,TSet?,TInst?,NodeArgs,AdditionalInfo*,Doc*) >
<!ATTLIST BPT rID ID #REQUIRED >

<!ELEMENT Doc (DName,ConfName?,Res,DVer?,TSet?,TInst?,RunType?,DT?,AdditionalInfo*,Step*,DIter*,Step*,Action*,Doc*,Summary?,TestMaintenanceSummary*,NodeArgs?) >
<!ATTLIST Doc rID ID #REQUIRED type (Test|BC|BPTWrapperTest|Flow|Group|Action) "Test" productName CDATA #REQUIRED BCIter CDATA #IMPLIED >

<!ELEMENT RunType ( #PCDATA )>
<!ATTLIST RunType fmStep (False|True) "False" batch (False|True) "False" upDesc (False|True) "False" upChk (False|True) "False" upAS (False|True) "False">

<!ELEMENT DName ( #PCDATA ) >

<!ELEMENT ConfName ( #PCDATA ) >

<!ELEMENT Res ( #PCDATA ) >

<!ELEMENT AdditionalInfo (AdditionalDataName,AdditionalDataValue ) >

<!ELEMENT AdditionalDataName ( #PCDATA ) >

<!ELEMENT AdditionalDataValue ( #PCDATA ) >

<!ELEMENT DVer ( #PCDATA ) >

<!ELEMENT TSet ( #PCDATA ) >

<!ELEMENT TInst ( #PCDATA ) >

<!ELEMENT DIter (Step*,Action+,Summary?,NodeArgs)>
<!ATTLIST DIter rID ID #REQUIRED iterID CDATA #REQUIRED>

<!ELEMENT DocLocation ( #PCDATA )>

<!ELEMENT Action (AName,AIter*,(Step|HtmlStep|Action)*, Summary,ActionMaintenanceSummary*, NodeArgs ) >
<!ATTLIST Action rID ID #REQUIRED>

<!ELEMENT AIter ((Step|HtmlStep|Action)*,DataMapping?, Summary?,NodeArgs) >
<!ATTLIST AIter rID ID #REQUIRED iterID CDATA #REQUIRED isCountable (False|True) "False" >

<!ELEMENT AName ( #PCDATA ) >

<!ELEMENT TestMaintenanceSummary (ActionMaintenanceSummary*) >
<!ATTLIST TestMaintenanceSummary ObjectsAdded CDATA #REQUIRED ObjectsUpdated CDATA #REQUIRED StepsUpdated CDATA #REQUIRED StepsComments CDATA #REQUIRED><!ELEMENT ActionMaintenanceSummary (ObjectChange* ) >
<!ATTLIST ActionMaintenanceSummary Action CDATA #REQUIRED Objects CDATA #REQUIRED Updated CDATA #REQUIRED LinesTotal CDATA #REQUIRED Added CDATA #REQUIRED LinesUpdated CDATA #REQUIRED>

<!ELEMENT ObjectChange  (Hierarchy, PropertyChangeList* ) >
<!ATTLIST ObjectChange Operation CDATA #IMPLIED OriginalRepository CDATA #IMPLIED>

<!ELEMENT PropertyChangeList (PropertyDef*) >

<!ELEMENT PropertyDef (OriginalValue, NewValue) >
<!ATTLIST PropertyDef PropName CDATA #REQUIRED OriginRegularExpression (True|False) "False" NewRegularExpression (True|False) "False" AddedProperty (True|False) "False" >

<!ELEMENT OriginalValue ( #PCDATA )>

<!ELEMENT NewValue ( #PCDATA )>

<!ELEMENT Hierarchy  (ObjectName, Hierarchy*) >
<!ATTLIST Hierarchy MicClass CDATA #REQUIRED>

<!ELEMENT ObjectName  ( #PCDATA ) >

<!ELEMENT Step (Obj,Details,Time,TimeTick* ,(Step|HtmlStep|Doc)*, DataMapping?, NodeArgs) >
<!ATTLIST Step rID ID #REQUIRED retval CDATA #IMPLIED>

<!ELEMENT HtmlStep (HTML,TimeTick*,(Step|HtmlStep|Doc)*,NodeArgs) >
<!ATTLIST HtmlStep rID ID #REQUIRED >

<!ELEMENT Obj ( #PCDATA ) >
<!ATTLIST Obj plainTxt (False|True) "True">

<!ELEMENT Details ( #PCDATA ) >
<!ATTLIST Details plainTxt (False|True) "True">

<!ELEMENT Time ( #PCDATA ) >

<!ELEMENT HTML ( #PCDATA ) >

<!ELEMENT Disp ( #PCDATA ) >

<!ELEMENT TimeTick ( #PCDATA ) >

<!ELEMENT DataMapping ( DataMappedItem* )>
<!ELEMENT DataMappedItem EMPTY >
<!ATTLIST DataMappedItem dsName CDATA #REQUIRED >
<!ATTLIST DataMappedItem rowId CDATA #REQUIRED >

<!ELEMENT NodeArgs (Disp,TopPane?,BtmPane?,ExtendedInfo? )>
<!ATTLIST NodeArgs eType CDATA #REQUIRED icon CDATA #REQUIRED nRep CDATA #REQUIRED UserNote CDATA #IMPLIED filter (False|True) "True">
<!ATTLIST NodeArgs status (Passed|Failed|Done|Warning|Information) "Done">
<!ATTLIST NodeArgs iconSel CDATA #IMPLIED nType CDATA #IMPLIED MovieMarker CDATA "">
<!ATTLIST NodeArgs Source CDATA #IMPLIED SourceLine CDATA #IMPLIED StepFlowItemKey CDATA #IMPLIED >

<!ELEMENT TopPane (Path)>

<!ELEMENT BtmPane ( (Path|WR)?,ASHilite?)>
<!ATTLIST BtmPane vType CDATA "HTML">

<!ELEMENT Path ( #PCDATA ) >

<!ELEMENT ASHilite ( #PCDATA ) >

<!ELEMENT WR ( #PCDATA ) >

<!ELEMENT ExtendedInfo ( StepData ) >

<!ATTLIST ExtendedInfo StepType CDATA #REQUIRED>
<!ELEMENT DT (NodeArgs) >
<!ATTLIST DT rID ID #REQUIRED>

<!ELEMENT Summary (Param*)>
<!ATTLIST Summary sTime CDATA #IMPLIED eTime CDATA #IMPLIED passed CDATA #IMPLIED failed CDATA #IMPLIED warnings CDATA #IMPLIED retval CDATA #IMPLIED stopped (False|True) "False" >

<!ELEMENT Param (ParamName,ParamVal)+ >
<!ATTLIST Param paramInOut (In|Out) "In">

<!ELEMENT ParamName ( #PCDATA ) >

<!ELEMENT ParamVal ( #PCDATA ) >

]
>
<Report ver="2.0" tmZone="India Standard Time">
<General productName="HPE Unified Functional Testing" productVer="14.03" os="" host="WINDOWS-UNR7VLH"><DocLocation><![CDATA[C:\Hybrid Framework\Driver\driver]]></DocLocation></General>
<Doc rID="T1"   productName= "HPE Unified Functional Testing"  >
<DName><![CDATA[driver]]></DName>
<Res><![CDATA[Res19]]></Res>
<DT rID="T2">
<NodeArgs eType="Table" icon="2" nRep="4" filter="False" >
<Disp><![CDATA[Run-Time Data Table]]></Disp>
<BtmPane vType="Table" >
<Path><![CDATA[Default.xls]]></Path>
</BtmPane>
</NodeArgs>
</DT>
<DIter rID="T3" iterID="1" >
<Action rID="T4">
<AName><![CDATA[Action1]]></AName>
<Step rID="T5">
<Obj plainTxt="False" ><![CDATA[SystemUtil]]></Obj>
<Details plainTxt="False" ><![CDATA[SystemUtil]]></Details>
<Time><![CDATA[18-03-2023 - 13:19:00]]></Time>
<TimeTick>1679125740</TimeTick>
<Step rID="T6">
<Obj plainTxt="False" ><![CDATA[Run "C:\Program Files (x86)\HPE\Unified Functional Testing\samples\Flights Application\FlightsGUI.exe",1]]></Obj>
<Details plainTxt="False" ><![CDATA[Run "C:\Program Files (x86)\HPE\Unified Functional Testing\samples\Flights Application\FlightsGUI.exe",1]]></Details>
<Time><![CDATA[18-03-2023 - 13:19:00]]></Time>
<TimeTick>1679125740</TimeTick>
<NodeArgs eType="Replay" icon="5" nRep="11" status="Passed" >
<Disp><![CDATA[Run "C:\Program Files (x86)\HPE\Unified Functional Testing\samples\Flights Application\FlightsGUI.exe",1]]></Disp>
</NodeArgs>
</Step>
<NodeArgs eType="Replay" icon="5" nRep="10" status="Passed" >
<Disp><![CDATA[SystemUtil]]></Disp>
</NodeArgs>
</Step>
<Step rID="T7">
<Obj plainTxt="False" ><![CDATA[HPE MyFlight Sample Applicatio]]></Obj>
<Details plainTxt="False" ><![CDATA[WpfWindow]]></Details>
<Time><![CDATA[18-03-2023 - 13:19:01]]></Time>
<TimeTick>1679125741</TimeTick>
<Step rID="T8">
<Obj plainTxt="False" ><![CDATA[HPE MyFlight Sample Applicatio.close]]></Obj>
<Details plainTxt="False" ><![CDATA[]]></Details>
<Time><![CDATA[18-03-2023 - 13:19:01]]></Time>
<TimeTick>1679125741</TimeTick>
<NodeArgs eType="Replay" icon="6" nRep="15" >
<Disp><![CDATA[HPE MyFlight Sample Applicatio.close]]></Disp>
</NodeArgs>
</Step>
<Step rID="T9">
<Obj plainTxt="False" ><![CDATA[SystemUtil]]></Obj>
<Details plainTxt="False" ><![CDATA[SystemUtil]]></Details>
<Time><![CDATA[18-03-2023 - 13:19:04]]></Time>
<TimeTick>1679125744</TimeTick>
<Step rID="T10">
<Obj plainTxt="False" ><![CDATA[Run "C:\Program Files (x86)\HPE\Unified Functional Testing\samples\Flights Application\FlightsGUI.exe",1]]></Obj>
<Details plainTxt="False" ><![CDATA[Run "C:\Program Files (x86)\HPE\Unified Functional Testing\samples\Flights Application\FlightsGUI.exe",1]]></Details>
<Time><![CDATA[18-03-2023 - 13:19:04]]></Time>
<TimeTick>1679125744</TimeTick>
<NodeArgs eType="Replay" icon="5" nRep="19" status="Passed" >
<Disp><![CDATA[Run "C:\Program Files (x86)\HPE\Unified Functional Testing\samples\Flights Application\FlightsGUI.exe",1]]></Disp>
</NodeArgs>
</Step>
<NodeArgs eType="Replay" icon="5" nRep="18" status="Passed" >
<Disp><![CDATA[SystemUtil]]></Disp>
</NodeArgs>
</Step>
<Step rID="T11">
<Obj plainTxt="False" ><![CDATA[agentName.Set]]></Obj>
<Details plainTxt="False" ><![CDATA["john"]]></Details>
<Time><![CDATA[18-03-2023 - 13:19:06]]></Time>
<TimeTick>1679125746</TimeTick>
<NodeArgs eType="Replay" icon="7" nRep="23" >
<Disp><![CDATA[agentName.Set]]></Disp>
</NodeArgs>
</Step>
<Step rID="T12">
<Obj plainTxt="False" ><![CDATA[password.Set]]></Obj>
<Details plainTxt="False" ><![CDATA["hp"]]></Details>
<Time><![CDATA[18-03-2023 - 13:19:07]]></Time>
<TimeTick>1679125747</TimeTick>
<NodeArgs eType="Replay" icon="7" nRep="25" >
<Disp><![CDATA[password.Set]]></Disp>
</NodeArgs>
</Step>
<Step rID="T13">
<Obj plainTxt="False" ><![CDATA[OK.Click]]></Obj>
<Details plainTxt="False" ><![CDATA[]]></Details>
<Time><![CDATA[18-03-2023 - 13:19:08]]></Time>
<TimeTick>1679125748</TimeTick>
<NodeArgs eType="Replay" icon="8" nRep="27" >
<Disp><![CDATA[OK.Click]]></Disp>
</NodeArgs>
</Step>
<Step rID="T14">
<Obj plainTxt="False" ><![CDATA[fromCity.Select]]></Obj>
<Details plainTxt="False" ><![CDATA["Frankfurt"]]></Details>
<Time><![CDATA[18-03-2023 - 13:19:09]]></Time>
<TimeTick>1679125749</TimeTick>
<NodeArgs eType="Replay" icon="9" nRep="29" >
<Disp><![CDATA[fromCity.Select]]></Disp>
</NodeArgs>
</Step>
<Step rID="T15">
<Obj plainTxt="False" ><![CDATA[toCity.Select]]></Obj>
<Details plainTxt="False" ><![CDATA["Portland"]]></Details>
<Time><![CDATA[18-03-2023 - 13:19:10]]></Time>
<TimeTick>1679125750</TimeTick>
<NodeArgs eType="Replay" icon="9" nRep="31" >
<Disp><![CDATA[toCity.Select]]></Disp>
</NodeArgs>
</Step>
<Step rID="T16">
<Obj plainTxt="False" ><![CDATA[FIND FLIGHTS.Click]]></Obj>
<Details plainTxt="False" ><![CDATA[]]></Details>
<Time><![CDATA[18-03-2023 - 13:19:11]]></Time>
<TimeTick>1679125751</TimeTick>
<NodeArgs eType="Replay" icon="8" nRep="33" >
<Disp><![CDATA[FIND FLIGHTS.Click]]></Disp>
</NodeArgs>
</Step>
<Step rID="T17">
<Obj plainTxt="False" ><![CDATA[flightsDataGrid.SelectCell]]></Obj>
<Details plainTxt="False" ><![CDATA[5, 3]]></Details>
<Time><![CDATA[18-03-2023 - 13:19:12]]></Time>
<TimeTick>1679125752</TimeTick>
<NodeArgs eType="Replay" icon="10" nRep="35" >
<Disp><![CDATA[flightsDataGrid.SelectCell]]></Disp>
</NodeArgs>
</Step>
<Step rID="T18">
<Obj plainTxt="False" ><![CDATA[SELECT FLIGHT.Click]]></Obj>
<Details plainTxt="False" ><![CDATA[]]></Details>
<Time><![CDATA[18-03-2023 - 13:19:12]]></Time>
<TimeTick>1679125752</TimeTick>
<NodeArgs eType="Replay" icon="8" nRep="37" >
<Disp><![CDATA[SELECT FLIGHT.Click]]></Disp>
</NodeArgs>
</Step>
<Step rID="T19">
<Obj plainTxt="False" ><![CDATA[passengerName.Set]]></Obj>
<Details plainTxt="False" ><![CDATA["bbb"]]></Details>
<Time><![CDATA[18-03-2023 - 13:19:13]]></Time>
<TimeTick>1679125753</TimeTick>
<NodeArgs eType="Replay" icon="7" nRep="39" >
<Disp><![CDATA[passengerName.Set]]></Disp>
</NodeArgs>
</Step>
<Step rID="T20">
<Obj plainTxt="False" ><![CDATA[ORDER.Click]]></Obj>
<Details plainTxt="False" ><![CDATA[]]></Details>
<Time><![CDATA[18-03-2023 - 13:19:13]]></Time>
<TimeTick>1679125753</TimeTick>
<NodeArgs eType="Replay" icon="8" nRep="41" >
<Disp><![CDATA[ORDER.Click]]></Disp>
</NodeArgs>
</Step>
<Step rID="T21">
<Obj plainTxt="False" ><![CDATA[HPE MyFlight Sample Applicatio.close]]></Obj>
<Details plainTxt="False" ><![CDATA[]]></Details>
<Time><![CDATA[18-03-2023 - 13:19:14]]></Time>
<TimeTick>1679125754</TimeTick>
<NodeArgs eType="Replay" icon="6" nRep="43" >
<Disp><![CDATA[HPE MyFlight Sample Applicatio.close]]></Disp>
</NodeArgs>
</Step>
<Step rID="T22">
<Obj plainTxt="False" ><![CDATA[SystemUtil]]></Obj>
<Details plainTxt="False" ><![CDATA[SystemUtil]]></Details>
<Time><![CDATA[18-03-2023 - 13:19:20]]></Time>
<TimeTick>1679125760</TimeTick>
<Step rID="T23">
<Obj plainTxt="False" ><![CDATA[Run "C:\Program Files (x86)\HPE\Unified Functional Testing\samples\Flights Application\FlightsGUI.exe",1]]></Obj>
<Details plainTxt="False" ><![CDATA[Run "C:\Program Files (x86)\HPE\Unified Functional Testing\samples\Flights Application\FlightsGUI.exe",1]]></Details>
<Time><![CDATA[18-03-2023 - 13:19:20]]></Time>
<TimeTick>1679125760</TimeTick>
<NodeArgs eType="Replay" icon="5" nRep="47" status="Passed" >
<Disp><![CDATA[Run "C:\Program Files (x86)\HPE\Unified Functional Testing\samples\Flights Application\FlightsGUI.exe",1]]></Disp>
</NodeArgs>
</Step>
<NodeArgs eType="Replay" icon="5" nRep="46" status="Passed" >
<Disp><![CDATA[SystemUtil]]></Disp>
</NodeArgs>
</Step>
<Step rID="T24">
<Obj plainTxt="False" ><![CDATA[agentName.Set]]></Obj>
<Details plainTxt="False" ><![CDATA["john"]]></Details>
<Time><![CDATA[18-03-2023 - 13:19:21]]></Time>
<TimeTick>1679125761</TimeTick>
<NodeArgs eType="Replay" icon="7" nRep="52" >
<Disp><![CDATA[agentName.Set]]></Disp>
</NodeArgs>
</Step>
<Step rID="T25">
<Obj plainTxt="False" ><![CDATA[password.Set]]></Obj>
<Details plainTxt="False" ><![CDATA["hp"]]></Details>
<Time><![CDATA[18-03-2023 - 13:19:22]]></Time>
<TimeTick>1679125762</TimeTick>
<NodeArgs eType="Replay" icon="7" nRep="54" >
<Disp><![CDATA[password.Set]]></Disp>
</NodeArgs>
</Step>
<Step rID="T26">
<Obj plainTxt="False" ><![CDATA[OK.Click]]></Obj>
<Details plainTxt="False" ><![CDATA[]]></Details>
<Time><![CDATA[18-03-2023 - 13:19:23]]></Time>
<TimeTick>1679125763</TimeTick>
<NodeArgs eType="Replay" icon="8" nRep="56" >
<Disp><![CDATA[OK.Click]]></Disp>
</NodeArgs>
</Step>
<Step rID="T27">
<Obj plainTxt="False" ><![CDATA[HPE MyFlight Sample Applicatio.close]]></Obj>
<Details plainTxt="False" ><![CDATA[]]></Details>
<Time><![CDATA[18-03-2023 - 13:19:24]]></Time>
<TimeTick>1679125764</TimeTick>
<NodeArgs eType="Replay" icon="6" nRep="58" >
<Disp><![CDATA[HPE MyFlight Sample Applicatio.close]]></Disp>
</NodeArgs>
</Step>
<Step rID="T28">
<Obj plainTxt="False" ><![CDATA[SystemUtil]]></Obj>
<Details plainTxt="False" ><![CDATA[SystemUtil]]></Details>
<Time><![CDATA[18-03-2023 - 13:19:24]]></Time>
<TimeTick>1679125764</TimeTick>
<Step rID="T29">
<Obj plainTxt="False" ><![CDATA[Run "C:\Program Files (x86)\HPE\Unified Functional Testing\samples\Flights Application\FlightsGUI.exe",1]]></Obj>
<Details plainTxt="False" ><![CDATA[Run "C:\Program Files (x86)\HPE\Unified Functional Testing\samples\Flights Application\FlightsGUI.exe",1]]></Details>
<Time><![CDATA[18-03-2023 - 13:19:24]]></Time>
<TimeTick>1679125764</TimeTick>
<NodeArgs eType="Replay" icon="5" nRep="62" status="Passed" >
<Disp><![CDATA[Run "C:\Program Files (x86)\HPE\Unified Functional Testing\samples\Flights Application\FlightsGUI.exe",1]]></Disp>
</NodeArgs>
</Step>
<NodeArgs eType="Replay" icon="5" nRep="61" status="Passed" >
<Disp><![CDATA[SystemUtil]]></Disp>
</NodeArgs>
</Step>
<Step rID="T30">
<Obj plainTxt="False" ><![CDATA[agentName.Set]]></Obj>
<Details plainTxt="False" ><![CDATA["john"]]></Details>
<Time><![CDATA[18-03-2023 - 13:19:26]]></Time>
<TimeTick>1679125766</TimeTick>
<NodeArgs eType="Replay" icon="7" nRep="67" >
<Disp><![CDATA[agentName.Set]]></Disp>
</NodeArgs>
</Step>
<Step rID="T31">
<Obj plainTxt="False" ><![CDATA[password.Set]]></Obj>
<Details plainTxt="False" ><![CDATA["hp"]]></Details>
<Time><![CDATA[18-03-2023 - 13:19:26]]></Time>
<TimeTick>1679125766</TimeTick>
<NodeArgs eType="Replay" icon="7" nRep="69" >
<Disp><![CDATA[password.Set]]></Disp>
</NodeArgs>
</Step>
<Step rID="T32">
<Obj plainTxt="False" ><![CDATA[OK.Click]]></Obj>
<Details plainTxt="False" ><![CDATA[]]></Details>
<Time><![CDATA[18-03-2023 - 13:19:27]]></Time>
<TimeTick>1679125767</TimeTick>
<NodeArgs eType="Replay" icon="8" nRep="71" >
<Disp><![CDATA[OK.Click]]></Disp>
</NodeArgs>
</Step>
<Step rID="T33">
<Obj plainTxt="False" ><![CDATA[HPE MyFlight Sample Applicatio.close]]></Obj>
<Details plainTxt="False" ><![CDATA[]]></Details>
<Time><![CDATA[18-03-2023 - 13:19:28]]></Time>
<TimeTick>1679125768</TimeTick>
<NodeArgs eType="Replay" icon="6" nRep="73" >
<Disp><![CDATA[HPE MyFlight Sample Applicatio.close]]></Disp>
</NodeArgs>
</Step>
<Step rID="T34">
<Obj plainTxt="False" ><![CDATA[SystemUtil]]></Obj>
<Details plainTxt="False" ><![CDATA[SystemUtil]]></Details>
<Time><![CDATA[18-03-2023 - 13:19:29]]></Time>
<TimeTick>1679125769</TimeTick>
<Step rID="T35">
<Obj plainTxt="False" ><![CDATA[Run "C:\Program Files (x86)\HPE\Unified Functional Testing\samples\Flights Application\FlightsGUI.exe",1]]></Obj>
<Details plainTxt="False" ><![CDATA[Run "C:\Program Files (x86)\HPE\Unified Functional Testing\samples\Flights Application\FlightsGUI.exe",1]]></Details>
<Time><![CDATA[18-03-2023 - 13:19:29]]></Time>
<TimeTick>1679125769</TimeTick>
<NodeArgs eType="Replay" icon="5" nRep="77" status="Passed" >
<Disp><![CDATA[Run "C:\Program Files (x86)\HPE\Unified Functional Testing\samples\Flights Application\FlightsGUI.exe",1]]></Disp>
</NodeArgs>
</Step>
<NodeArgs eType="Replay" icon="5" nRep="76" status="Passed" >
<Disp><![CDATA[SystemUtil]]></Disp>
</NodeArgs>
</Step>
<Step rID="T36">
<Obj plainTxt="False" ><![CDATA[agentName.Set]]></Obj>
<Details plainTxt="False" ><![CDATA["john"]]></Details>
<Time><![CDATA[18-03-2023 - 13:19:30]]></Time>
<TimeTick>1679125770</TimeTick>
<NodeArgs eType="Replay" icon="7" nRep="82" >
<Disp><![CDATA[agentName.Set]]></Disp>
</NodeArgs>
</Step>
<Step rID="T37">
<Obj plainTxt="False" ><![CDATA[password.Set]]></Obj>
<Details plainTxt="False" ><![CDATA["hp"]]></Details>
<Time><![CDATA[18-03-2023 - 13:19:30]]></Time>
<TimeTick>1679125770</TimeTick>
<NodeArgs eType="Replay" icon="7" nRep="84" >
<Disp><![CDATA[password.Set]]></Disp>
</NodeArgs>
</Step>
<Step rID="T38">
<Obj plainTxt="False" ><![CDATA[OK.Click]]></Obj>
<Details plainTxt="False" ><![CDATA[]]></Details>
<Time><![CDATA[18-03-2023 - 13:19:31]]></Time>
<TimeTick>1679125771</TimeTick>
<NodeArgs eType="Replay" icon="8" nRep="86" >
<Disp><![CDATA[OK.Click]]></Disp>
</NodeArgs>
</Step>
<Step rID="T39">
<Obj plainTxt="False" ><![CDATA[HPE MyFlight Sample Applicatio.close]]></Obj>
<Details plainTxt="False" ><![CDATA[]]></Details>
<Time><![CDATA[18-03-2023 - 13:19:32]]></Time>
<TimeTick>1679125772</TimeTick>
<NodeArgs eType="Replay" icon="6" nRep="88" >
<Disp><![CDATA[HPE MyFlight Sample Applicatio.close]]></Disp>
</NodeArgs>
</Step>
<NodeArgs eType="Context" icon="6" nRep="14" status="Passed" >
<Disp><![CDATA[HPE MyFlight Sample Applicatio]]></Disp>
</NodeArgs>
</Step>
<Summary sTime="18-03-2023 - 13:18:58" eTime="18-03-2023 - 13:19:32" passed="5" failed="0" warnings="0" ></Summary>
<NodeArgs eType="StartAction" icon="4" nRep="7" status="Passed" >
<Disp><![CDATA[Action1 Summary]]></Disp>
</NodeArgs>
</Action>
<Action rID="T40">
<AName><![CDATA[Action2]]></AName>
<Summary sTime="18-03-2023 - 13:19:33" eTime="18-03-2023 - 13:19:33" passed="0" failed="0" warnings="0" ></Summary>
<NodeArgs eType="StartAction" icon="4" nRep="90" >
<Disp><![CDATA[Action2 Summary]]></Disp>
</NodeArgs>
</Action>
<Action rID="T41">
<AName><![CDATA[Action3]]></AName>
<Summary sTime="18-03-2023 - 13:19:33" eTime="18-03-2023 - 13:19:33" passed="0" failed="0" warnings="0" ></Summary>
<NodeArgs eType="StartAction" icon="4" nRep="92" >
<Disp><![CDATA[Action3 Summary]]></Disp>
</NodeArgs>
</Action>
<Action rID="T42">
<AName><![CDATA[Action4]]></AName>
<Summary sTime="18-03-2023 - 13:19:33" eTime="18-03-2023 - 13:19:34" passed="0" failed="0" warnings="0" ></Summary>
<NodeArgs eType="StartAction" icon="4" nRep="94" >
<Disp><![CDATA[Action4 Summary]]></Disp>
</NodeArgs>
</Action>
<NodeArgs eType="StartIteration" icon="3" nRep="6" status="Passed" >
<Disp><![CDATA[driver Iteration 1 (Row 1)]]></Disp>
</NodeArgs>
</DIter>
<Summary sTime="18-03-2023 - 13:18:54" eTime="18-03-2023 - 13:19:34" passed="5" failed="0" warnings="0" ></Summary>
<NodeArgs eType="StartTest" icon="1" nRep="3" status="Passed" >
<Disp><![CDATA[Test driver Summary]]></Disp>
</NodeArgs>
</Doc>
</Report>